{
  "schema_version": "2.0",
  "event_id": "2af4c513-d87d-4cd9-bd22-8dbb8c5e4505",
  "event_type": "simulation_execution.input_downloaded",
  "simulation_execution_id": 1,
  "run_id": "b32d7028-0f8c-464a-9d15-a928d292fb0a",
  "attempt_id": "9404fdcc-63e3-4f44-a4a3-480224c590ef",
  "simulation_key": "lri",
  "downloaded_at": "2026-09-07T09:25:02Z"
}
